Нутриент,Функции,Признаки дефицита,Продукты,Суточная норма
Витамин A,Здоровье зрения, рост и развитие, иммунитет,Плохое зрение в темноте, сухость кожи/глаз,Морковь, шпинат, яйца,900 мкг**
Витамин B1,Углеводный обмен, поддержка нервной системы,Бери-бери, слабость, раздражительность,Цельнозерновые, бобы, свинина,1,2 мг
Витамин B2,Выработка энергии, здоровье кожи, глаз,Трещины в уголках рта, дерматит,Яйца, обогащённые злаки, молоко,1,3 мг
Витамин B3,Преобразование пищи в энергию, поддержка нервной системы,Пеллагра (дерматит, диарея, деменция),Мясо, рыба, орехи,16 мг**
Витамин B5,Метаболизм жиров/углеводов, гормоны, нервная система,Усталость, раздражительность, проблемы ЖКТ,Авокадо, яйца, бобовые,5 мг
Витамин B6,Метаболизм белков, иммунитет, нервная система,Раздражительность, анемия, дерматит,Нут, рыба, картофель,1,7 мг
Витамин C,Антиоксидант, синтез коллагена, иммунитет,Кровоточивость дёсен, плохое заживление ран,Цитрусы, перец, брокколи,90 мг
Витамин D,Кости, иммунитет, регуляция кальция,Остеопороз, слабость костей,Рыбий жир, яичные желтки, обогащённые продукты,20 мкг**
